group,name,rating,review
review,135446487,3,"一起来举报吧.游戏是好游戏,小妖怪很可爱,策划脑子不行,嘉年华伤透心,而且外挂横行,没办法解决游戏的平衡,而且存在误封严重,一起来捉妖,玩成了一起来举报,惭愧不.估计是新游戏,有时候存在一些bug比如说,有蛋的擂台有些玩家看不到蛋还能打,或者切宝宝蓝屏这些"
review,87420110,1,"辣鸡游戏.活这么久玩过最辣鸡的游戏,ch脑残,地域歧视,不公平公正,我为玩过这游戏感到自卑,感到耻辱."
review,李家7,3,"请更新.为什么灵石里面的妖灵不能自己来定呢,不然老是出有的妖灵,一点意思都没有了."
review,风清香1996,5,5星差评了解下.不花钱玩游戏.就不好玩.但是戒不掉.
review,嘤咛，,3,"一点也不人性化.模仿宝可梦完全没模仿像,宝可梦是可以走路捉精灵的,它这不能走,也不能走高速,准备卸载了"
review,我的世界苦力怕（学生党）,5,"反馈.能不能把游客的功能再扩大一点,连集市买东西都买不了."
review,马脓,2,"嘉年华真的是逼退.抓快两万了,比不上两天嘉年华"
review,航母编队3,2,"本来可以给4星的,我特么抓了快1万只才出一只满资质,人家嘉年华一天62只满资质,玩什么,凉了.凉了,这游戏"
review,音质没开始好了,4,"大致都很满意.就是妖灵背包太少了,养成空间也太少了"
review,小二很酷,5,"赞一下.我非常喜欢这个游戏,希望多点高资"
review,chris_chi,5,惊喜多多.看脸游戏一向玩不好但是捉妖使我快乐呀.😁😁😁
review,一路向阳625,5,"更新后下载不了也更新不了咋么回事.更新后我的苹果手机就更新不了了,删掉游戏后还是下载不了,怎么回事.有一样问题的么"
review,Rikki211,2,"江湖不见.没啥好说,准备退坑了.玩了三四个月了,41级连上活动给的,满资就三个.辛辛苦苦走了十几公里,灵石摇出来的全部都还不如我随手在街边抓的.接连几次拒宅日毫无新意.活动出现的妖毫无吸引力不说,大热的天去参加活动了,一只能发牌子的高资的都没有.分数低的当粮都觉得可怜,路边偶遇抓到的资质普遍都比活动的高,我还干嘛来参加你这个活动.这次嘉年华又是新妖又是高资的.但和广州以外地区的各位完全没啥关系.外地朋友就是想去,但一个周末为了个游戏跑那么远真不至于,咱还有工作生活呢.也不提飞机党开挂作弊多啥的了.这游戏我就当他是个单机,别人咋样都无所谓了.诸多不满累积,这游戏玩的既不平衡也不开心.散了算了,江湖不再见."
review,sjsjaka,1,"老玩家有感.被线下活动恶心到了,半年不及别人半天收获"
review,摁-,3,"进不去游戏.游戏中提示热刷打不了boss,我卸载重装一直卡在解压中（好多次了）,存储空间还有26g左右,,无语,,"
review,倾奈何做贼,3,"封号无底线.举报人多就封,好好一个游戏被ch玩死了"
review,一飞冲天2507,2,"游戏奖励不公平.游戏确实还是不错的,策划也很用心,但是,这个游戏对氪金玩家一点都不友好,充了钱比不充钱的没有多一点好处,反而出高资比不充钱玩家还少,周末活动也是,充了钱照样不出毕业妖灵,辛辛苦苦调班下午活动,两个小时都是垃圾妖灵,垃圾奖励,没有玩下去的动力,删游戏了."
review,我祝你游安康,2,"策划真是脑残.中午12点打擂台,11点半策划上班开始更新到下午,1个G的更新包没WiFi不能下载,晚上下班回家已经超时不能做日常,我玩你马了"
review,ZYTVD,3,"打开app的音乐声音太大了.每次点开游戏,背景音声音太大,安静的环境中吓一跳."
review,冰封的世界OL,5,"嘉年华活动真好.玩了四个月天天18买门票,人家一次120嘉年华活动一次搞定真好.这是好游戏"
review,48226255,1,"垃圾游戏.垃圾到不能再垃圾的游戏,除了会圈钱其他什么也不会,遇到问题,反馈给他,踏马得鸟都不鸟你.外挂满天飞也不管,还踏马默认开挂"
review,岛屿求生存,4,游戏就一般般而已..不能自己走害得我不能抓胡巴.所以不怎么好玩.
review,姽婳之久,3,"太累太辛苦.本来挺好一运动游戏,整得太累了,还成天打擂守擂,成天得抓,太累了,玩不动."
review,安徽一区紫蓬山剑过无痕到此一游,5,"5星为了让大家看到.这游戏是两天前下的,玩了3天今天下午上号提示被封10年😂,我不申诉了反正就玩了3天.我就是纳闷我是为啥被封的.我说到这里,肯定有人心里默念“挂逼还冤,再怎么解释你也肯给你开挂了.”但是你们细想苹果手机开挂多麻烦,我才玩3天都没懂游戏,我开挂干啥.谁会把一个无所谓有无得游戏账号,把手机越狱去开挂...你们品细品.我下载的时候就看到很多人说乱封号,我就想反正我不开挂,我不怕谁知我33岁的人了,有生终于尝了被游戏封号的滋味,还不是因为我开挂.言尽于此,大家保重."
review,大的反,2,"垃圾游戏,圈钱无底线.一个嘉年华毁了一个游戏,辛辛苦苦几个月不如人家1小时,垃圾游戏,第一次看到如此犯众怒的活动,圈钱无底线,垃圾.还老子打神灵买票钱."
review,李家7,3,"请更新.为什么灵石里面的妖灵不能自己来定呢,不然老是出有的妖灵,一点意思都没有了."
review,为毛要名字,5,"垃圾策划.捉妖四个月,不如广州一天游五星好评只为让你们看到"
review,difndkakfk,1,"垃圾游戏.封玩家的惩罚机制等于劝退玩家,降低游戏对玩家的吸引力,玩家退游主要是策划没有根据玩家需求改正错误失败的设计,同时没有设计出吸引玩家乐趣的游戏设计,说白了策划和美术很多时候都是闭门造车,即使客户玩家群体提出意见也装作听不见,封玩家机制等于和玩家成为对立面,同时不能解决冷门城市玩家无人组队打神灵,冷门城市玩家如同鬼蜮,不飞去热门城市怎么玩?结果策划不但不想办法解决问题就单一的锁头劝退玩家,真是服了,使用飞机的惩罚完全可以只锁一下不让打擂台.其他的不让打神灵,不让打各种怪和任务是什么鬼设计.只能不断的劝退玩"
review,太委屈通知,1,"策划司马.垃圾策划脑子有病,你妈只教你道歉连做人都没教你,一出啥事就道歉,好好一游戏被你整成这样,你没妈妈吗,九年义务教育没上完.啥垃圾东西都出就不出好东西,多好一游戏就可惜有个辣鸡策划,天天就知道跟玩家对着干,江如愿好好的削,颜如玉好好的削,游戏才几个月就出来了嘉年华,你nb是吗,祝你成为凉的最快的游戏."
review,由于v不到北方v恶臭fevfwfdd,4,"还好.我刚开始我挺好,好几天不玩了然后我就一直卡在开始见面了加载也很慢我以为是遇到了bug就删除了再下回来也一样.希望官方能够改进但总体很好👍"
review,静熙1111,3,"一直不出满资.系统时常出故障,玩好久都没有满资"
review,LOYEYUM,2,"分享图片到微信返回游戏需要重新登陆.如题,每次登陆完分享图片或是妖灵等任何东西返回游戏都有重新登陆,之前不会这样的,这是个最大的bug,望尽快修复"
review,月🈷️月月月月,3,"非法游戏行为被禁止使用.非法游戏行为（解禁时间为20290909）莫名其妙,不知道为什么被认定非法行为,怎么也登陆不了了."
review,矣乙,5,全世界唯一一个让开挂的都玩不下去的游戏.嘉年华牛逼
review,飞机场先进,3,"服了.能不能把开始画面的声音设置底一点,几款腾讯游戏怎么就你这么突出."
review,龙上恋0801,2,"未知应用如何处理..我是在这里下载的游戏,不是第三方下的,为什么邀请好友上线,提示未知应用的应用请求.给个解决方案"
review,macymacy999,4,"加载太慢.我开始加载的时候非常慢后面还进不去,请改正"
review,vlP我恨你,4,"可以关掉健康系统吗..我是个三年级的学生,之前也下过,昨天又下了一次,你新版本出个健康系统让我很无语,我39级了,我玩游客玩到39级了,你搞个健康系统让我又删了.希望程序员可以改进一下"
review,UMaRu小埋,3,"游戏好,缺点也不少.作为一个未成年人,一开始就被游戏的各种有趣的妖灵吸引住了,并花了很多时间来玩这个游戏.虽然一开始九点钟就下线,但也找到了破解的方法.可自从更新之后,九点以后完全玩不了.两小时限制也就算了,九点这个限制是真的让人受不了,何况16岁以下玩这个游戏的儿童,谁又会九点就上床睡觉.有时候为了开灵石辛辛苦苦出去散步,回到家却发现已经过了九点了,又白走了一天,走的距离也因为不能登陆而不能录入,恳请更改这个灵石机制.或者强制下线时间推迟一下吧,不然只有弃坑了"
review,元气小猥,3,简直是史上bug最多的游戏.然鹅这么敷衍的骗氪游戏我还在玩
review,真·三十二,5,"资源不够用.游戏是个好游戏,但是飞机是在太多了,没有飞机玩起来太难了,作为一个手动挡玩家,现在天气这么冷,外出敲鼓抓妖实在太难了,能不能平衡一点,不然像我们这样的手动玩家,就靠着神行,想要攒资源实在太难了"
review,圈圈jsjfjxhhw,1,"哪些沙雕给的五分,刷的吧.千万别忘的沙茶游戏,我前前后后花了几万块没人家一百块广州抓的云纹高姿多.智障策划实在是无法言语,之前配猫内部人员泄露配方赚钱,后面嘉年华现场盖章人员远程盖章赚钱,这游戏管理真的是一团混乱,再见了您呐,几万块喂狗了就当"
review,kaixuyin,1,"垃圾游戏.跟玩单机一样没事还开始商业活动,一天到晚的就想着挣钱,所有的活动都在广东,不断的劝着大家退游"
review,丹哥们,4,"满资是什么.玩了39级一个满资没抓到,每天看别人发各种满资,羡慕嫉妒,人家二三十级都能抓到满资,我想知道这个是怎么分配的呢,没有百分比什么的么,比如几级开始有几率或者抓到多少只后有个几率,我这几率等于0啊,二人转里朱买臣媳妇说他,连下三天当官的雨,一滴也淋不到他头上,我都玩多久了一个抓不到,怎么也得有个概率吧,或者就是说不充钱的就难抓到,那我就认了,玩这个游戏我其他玩好几年的游戏都放那好几个月不玩了,有点伤我的小心脏了都😢"
review,余生伱好,4,"捉妖求满资.敢不敢来一个满资,四十级了一个都没有."
review,大D坐红van,1,"每天闲来无事就1星.对这个游戏深感失望,每天闲来无事就给1星差评."
review,魑魅魍魉即正义,1,这游戏真好玩.游戏好玩但是游戏不友好差评.
review,Yww491001,5,"蛮好玩的.体验不错,玩了3天了,就是御灵团战找不到人"
review,这个迈着 萨克塞纳先是,4,"国外为什么不可以玩.在国外现在可以玩么,我以前在国内的时候玩的不错,出国后就地区限制啦,地区未开发,不知道现在可以玩"
review,小九分Ly,4,小地方玩的人少鼓也少有的妖也没有.鼓少妖少
review,还不到名字,2,"外挂横飞.先是外挂到处但是,搞得游戏无法经营,很多人退游,然后搞个垃圾嘉年华导致大部分人退游,然后所谓的严打外挂,偶尔封一两个都是3天的做做样子,不敢封太多怕别人退游,现在日以继夜的出新的,降低奖励,给蚊子腿人家吃,坑人充钱,对外挂更是置之不理,举报都不受理,老玩家100个走剩那么几个,还有好多小朋友傻傻的下载去玩,浪费时间,让人坑钱."
review,海鲜火锅,1,"一起来广州.你还在每天打神灵么.你还在每天找星移一次限定的伙伴.你还担心没超资妖么.不用怕,只要来广州,不用一个月,不用一个星期,也不用一天,只要2小时全部毕业.广州欢迎您.论广州嘉联华抓妖两万八,满资只抓仨广州嘉联华,遍地三十加灵力无限给,满资一球抓只要两小时,全部毕业拉抓妖无上限,云纹随便刷半天百来万,顶我半月抓充钱全喂狗,策划sima兄嘚想开啥呢想开点说不定你哪天辛辛苦苦赚的砖石买到的高资***是人家广州运来的呢有"
review,不要玩一起来捉妖,4,"乱封号..游戏说我近三天内存在作弊行为,封我7天号.本人三天内绝对没有使用过任何作弊行为,本人腾讯客服投诉要求告知给我使用作弊的证据,客服回答我具体检测判罚数据及后台数据无法直接提供给玩家还请玩家回顾近期游戏行为.我觉得这样的游戏让玩家心寒,只要你有钱也可以花钱请人举报肯定会封号,虽然一个小号,我同事去了一趟北京出差被封了10年,他也没使用过任何外挂和作弊行为.我觉得客服不作为."
review,七星战川,4,"游戏卡顿怎么回事.捉妖的时候特别卡,重新进就好了."
review,灵岳,3,"弃坑了.开始玩着还行,后面越来越枯燥,每天就是扔球扔球扔球.."
review,lllandzyy,4,游戏不错但是玩的我好累该给的不给.4/11号跳出来一起来捉妖这个游戏很好奇然后就下载了玩了游戏很新颖很有趣很好玩玩到现在就觉得游戏一点不友好基本上天天玩了吧充钱也不少了灵石开到现在也900多了雨收云也不给别人200多个灵石就出两个雨收云现在都出风振叶了现在让我有点不想玩了游戏平衡.
review,bonnie8988,3,还可以就是加载慢进不去.这游戏还可以就是加载太慢了总是进不去希望官方能把这个改掉
review,5区原始咆哮—天涯之旅,5,"什么时候能整治一下擂台挂..擂台赛从一开始的遮遮掩掩到现在的光明正大地出来,一路铺到腾讯总部门口,想知道你们为什么不作为."
review,jhbfjfgn,5,"策划大大真的离谱.真的这游戏开始来说真的很棒,但是后来的一起去广州🐶策划就真的不把人当人"
review,waltzreo,5,"户外版阴阳师.尤其是兽型妖越来越少的是,更加觉得这是阴阳师,更喜欢符合生物学结构的兽型妖"
review,巷里糖人,4,"无题只有建议.第一的评论是什么乱七八糟的.看了叫人觉得不舒服.于是有了这条.游戏我觉得挺好玩的,我把它当成精灵宝可梦,去收集妖精,解锁图鉴,像是一个收集类的爱好一样,所以之前很多人退坑了说无聊我也没觉得.毕竟是休闲类的游戏就是给大家打发个午觉时间而已.也许是我对游戏看的比较淡.所以连着玩了两个号,大小号历时5个月加一起才3个满资质,有一个还是系统活动给的,是的,大小号都41级了,3个满资质.概率安排的我也是明明白白.还有游戏里面的衣服,属实有点贵,所以只买了一套,毕竟那概率也没有让我充钱的心情,上次改版很多人吐槽过了,然并卵所以不说了吧.这游戏如果不凉,我还是会一直收集妖精的,资质高的更好,不高也习惯了……"
review,646648183凶你,1,最蠢的游戏.这游戏是我要过最蠢的游戏.小作坊出品
review,mtlmgan,1,"垃圾游戏,建议下架关服.优化贼烂,bug贼多,动不动封你号,我将近45天没玩,上去游戏自己几个台子被人打了,我神行过去打完就掉游戏,再登陆就显示封号3天.客服啥的也不解决问题,一等回复就是几天,我玩你吗臭嗨,我卢本伟没有开挂,我要开挂当场暴毙"
review,啦攋,1,"垃圾.页面什么七夕活动选另一半要发到社交平台但是一直没有跳到第三方,页面一直卡在哪,不管换无线网或者流量进去都是哪吊样,刚开始玩感觉还有兴趣,现在立即删掉,跟个单机游戏一样."
review,赵慧婷,4,"在国外不能玩.我们在国外的中国人不能玩.所以我建议把国家给打开这样子,这样我们都能玩了其实我也挺喜欢这游戏的也看上他了就是不能玩."
review,匿名158469,2,"花里胡哨.我还是喜欢宝可梦go,界面清晰大方,游戏规则一目了然,背景乐给人一种很激进的感觉,再加上本来就是一个有着十多年的动漫作品,我反正是从小就开始看的一部动画片,里面的情感肯定也掺杂了一些怀念的回忆,所以这游戏让我达到了很痴迷的地步,这游戏真的不是一个游戏了已经,把我的心都给抓走了."
review,小强阿啊,3,不安全.没什么吸引人的呢还耗时间走在街上还要经常看手机.安全.
review,skymid,4,"妖灵.妖灵放归的时候,只能一个个的搜出来,不然不都知道每种妖灵有几个.按战斗力和名称组合排序不行吗.非要按战斗力排序.找起来特别麻烦."
review,fslsp,4,从来没抓过一只全满.我从出这个游戏开始玩到现在中间有退游一段时间我玩那么久从来没抓过一只全满我就两只全满一只灵石出的一只活动领的从来没抓过全满我朋友比我晚玩抓了4只全满了我
review,天天捉妖,2,"更新一天就玩不到游戏.昨天更新好游戏还能玩,现在说客户端过低,气死人"
review,Somnus777,3,"为什么总是更新,没完没了的更新.为什么总是更新,没完没了的更新"
review,天津坏蛋,5,希望官方越做越好严厉打击飞机.希望官方越做越好严厉打击飞机
review,aa9840,2,"画风突变.冲着萌版造型玩这游戏的,结果后面出的妖灵都变成二次元画风了,实在是恶心不想玩下去了"
review,荧光姜丝,4,"声音问题.IOS打开游戏的时候总是一声巨响(声音突然特别大,进去后才会变成原来的音量),特别是带了耳机简直想死,我发现很多人都有这个问题,希望可以修复一下🙃🙃🙃,但游戏还是可以滴挺好玩的"
review,纳兰花颜,3,为什么一直闪退.本来玩了很久的游戏有一段时间就进去又退出来一直闪退
review,好咯去家族,1,"此游戏,是第一个让我心凉的游戏.从4月14到现在月,足足4个多月的时候,每天300+的捉妖数,敲鼓数,每天的神灵,弄的满满的,花费了大量的金钱精力时间,以为这个游戏会越做越好,结果呢,一次嘉年华活动,多少骂声.一个句芒我们花6块钱的门票打,活动100+.云纹过百万.辛辛苦苦的玩了这么久还没一次嘉年华来的快,两个小时130块,比过了我们4个月,远超过数倍130的金钱换来的结果,说真的玩游戏那么多,充钱那么多这是我见过最垃圾的活动,最智障的策划,为了圈钱什么都敢干,一次嘉年华劝退无数玩家,微博骂声一片,没有什么解释,还来一个辟谣解释,避重就轻有意思吗.别人的钱就是钱,我们的钱就不是了.130缺吗.都不缺那点钱,杀鸡取卵有意思.你是指望这些花了130的玩家养这个游戏还是指望大众玩家呢.这个事情还没完,就想下一个嘉年华,一点补偿没有,还有脸出礼包.呵呵了,都说腾讯游戏都是花钱才能玩,这个无所谓,但是呢,捉妖呢.花钱了还这么冤枉,4个月的钱光门票打神灵都超过千了,呵呵了,这个游戏还是改名吧,就叫一起嘉年华吧,介绍可以写一次线下嘉年华,门票130你将拥有所有,超过百万的云纹,无数的满资,高资,总结一下,我对这个游戏从热情似火到现在的满心失望,说真的后悔玩这个游戏了,几千块它买排骨不香吗.最后一句,住一起嘉年华早日凉凉吧"
review,短脖子长颈鹿c,4,"一个从开服的老玩家讲俩句嗷.希望游戏真的是从好玩出发让玩家充钱,像什么月卡啊笔记啊我都有充值,这个游戏要多为新玩家考虑,不要一味为了赚钱不在乎游戏本身存在的问题游戏最大的弊端就是对新玩家不友善,像之前的五星神灵时间boss新玩家只能靠着老玩家星移才能开图鉴,能用不能用的都不说.我有个想法其实可以做一些擂台投票选神灵比如大家选了巨芒在一小时以后或者规定时间出巨芒平时正常出这个时期的五星神灵这样之前五星神灵返场也对新玩家是很好的.还有我想说哈,这个青女未免时间太久了啊.之前五星神灵都存在一个月左右,每天买票一天打四次都不够升级一只的符印还要无相符印来凑才够,这次倒好青女每天一张免费票符印都快够养第二只了,差不多换换神灵了.光指着老玩家赚钱能有多少老玩家也在不断退游,没有新玩家的加入早晚凉凉."
review,小老弟你跟我两搁这扯犊子呢？,3,"想要情怀不只是模式.游戏是模仿宝可梦go的,说实话刚开始把它当宝可梦go玩,但是没有情怀支撑很快和大部分人一样觉得乏味,再加上模式的限制,很快就都修仙了"
review,超爱琦琦出满资,5,"希望一起来捉妖越来越好.这个游戏挺好的,玩了几个月了,虽然后面还是挺费神的,但是游戏的每一次满资高资截图都让我特别特别惊喜,虽然我好像好久没抓满资了,但是最近抓的也有一些近满截图,前段时间脾气比较暴躁,一个截图都没有特别生气,然后出言不逊骂人了都,没办法那时候只能运气差,再差的运气只要突然会给你一个截图都特别惊喜,我觉得这是一个充满惊喜的游戏.希望策划大大给满资..."
review,扬飞驰,1,"既然你们放弃了这游戏,也没什么好说的.抓妖两万八,满资只抓仨广州嘉年华,遍地三十加灵力无限给,满资一球抓只要两小时,全部毕业拉抓妖无上限,云纹随便刷半天百来万,顶我五月抓"
review,月🈷️月月月月,3,"非法游戏行为被禁止使用.非法游戏行为（解禁时间为20290909）莫名其妙,不知道为什么被认定非法行为,怎么也登陆不了了."
review,好0084,2,"密码.垃圾游戏,下载起先不用密码,后来又要密码了,有些还要付钱不要下载."
review,姚晓梦,3,游戏是好游戏.这游戏是好游戏可惜被做烂了外挂满天飞摊位不够灵石大量开2829的宠出来导致抓的2829的完全卖不掉这游戏已经脱坑几个月了被策划玩死的
review,幕了组,1,"垃圾游戏.建议新人下载了有以下几点1,该游戏不充钱都玩不下去,充钱你就可以是大佬.2,游戏中存在各种漏洞,比如暴露玩家隐私等等问题3,这游戏比的不是技术,比的是谁花的钱多,如果你充的钱多你甚至可以举报别人开挂,哪怕对方没开挂.只要你画的钱够多对面一样会被封号.4,游戏每一次更新基本就是在圈钱,每次更新只更新消费系统.并为下一波圈钱做前期准备.5,不信的可以下来玩玩,看是不是我说的这样.6,鉴定完毕Ljyx."
review,ddrbao,4,"改版后,策划的脑子水少点了….支持策划脑子的水越来越少…"
review,想个不重名的id好难 奸诈！秋瞳！,1,"的确希望有个拍卖行,摆摊浪费生命.平民玩家不肝,什么好东西都木嘻嘻"
review,沃德颠纳,2,"看见降分我就放心了.游戏是好游戏,策划够呛,每次更新必拖延,游戏公平性差,旱的旱死涝的涝死"
review,归宿大舅,1,"这是我见过最烂的团队,最烂的策划.这是我见过最烂的团队,最烂的策划"
review,べ花梦白ヾ,5,"我是御灵师-花梦白.捉妖这款游戏其实挺不错的,虽然是游戏,但是可以促进玩家外出走动.只是我不懂的是为什么不管我抓没抓妖灵,抓怪有时候都是一球跑,而且抓这么久没出满的.哎,希望策划,让我欧皇几天吧.很喜欢一起来捉妖,我今年斗30了,我还是喜欢这款游戏."
review,米糖纸,3,"居然自动5星..可以啊,刷分也就算了,还敢自动"
review,游戏岳叔叔,1,"想知道什么是一刀满级吗..一次嘉年华2小时顶平时4个月收益,厉害,佩服,一星都不想给."
review,蓝白11111,1,"垃圾游戏.这游戏是真的凉了,都没啥人玩,集会所摊位就两个,还要以市为单位划分."
review,司雨123,3,"游戏有待改进.这款游戏也玩一段时间了,目前为止感觉不太适合所有玩家,缺少点公平性,首先开发者没有考虑到打工一族没双休这一点,每次有新妖灵活动都设置在上班时间,别忘了腾讯旗下很多会员也有他们的一份"
review,q120333606,5,"身体扛不住.明天都要对准圈圈来个几百回,好刺激的游戏,让人心脏砰砰砰,一次次的碰撞让我欲罢不能,很棒的游戏"
review,edwinye,1,一个被游戏策划毁掉的游戏.开始觉得还蛮好玩的…但是挡不住脑回路不正常的策划.昨天广州嘉年华彻底把我弄炸了.为什么广州就可以高人一等.我们充值的钱比你的门票130少嘛.
review,J.&ad,1,"辣鸡游戏骗钱搞地域歧视,玩家幸幸苦苦充钱肝了4个月不如人家嘉年华一天的收获.游戏开发商联合工作室垄断猫市场.辣鸡游戏骗钱搞地域歧视,玩家幸幸苦苦充钱肝了4个月不如人家嘉年华一天的收获.游戏开发商联合工作室垄断猫市场"
review,jdbehhedbbdxnjhwhh,1,擂台挂横行.这游戏擂台挂横行举报半年了官方毫无作为垃圾游戏
review,立体感很生气,1,"一手好牌打的稀烂.游戏赶紧下线吧,看看你们狗策划都做了什么事情,建议新人别入坑,要么入坑前先去贴吧了解下游戏情况……我玩游戏也有20多年了,捉妖是最垃圾的一款,没有之一"
review,YouKasi,1,"不吐不快.作为一个老玩家,就是亲眼见证着这游戏被策划一步步弄死,真的厉害."
review,衡常性,3,"..原本是一个挺好的游戏却被策划盘坏了,三颗全为了情怀."
review,火星刃,5,"新颖的游戏方式,多给新玩家福利.谢谢,我是新手."
